{"apiPreflight":{"apiManifestRef":{"hash":"0438bb49b2b23197e79b60a5325a5061e066179a42bf4b013c5fcfdece16b4d5","hashAlgorithm":"sha256","path":"sources/surfaceops-kanban-live/kanban-cards-api-manifest.json","schemaId":"kanban-cards-api-manifest.v0","sourceRef":null},"deniedEndpoints":["PUT /api/state","POST /api/team/invites","DELETE /api/team/members/:memberId","POST /api/boards/:boardId/flow/ai-draft","POST /api/boards/:boardId/flow/apply","DELETE /api/boards/:boardId/agent-sessions/:sessionId"],"endpointCount":11,"localOnly":true,"status":"pass"},"artifactRefs":[{"hash":"ef5b6a63ef5d2d51108bb41429957c0a878372b735d67b1b7ff839c3956867ce","hashAlgorithm":"sha256","path":"artifacts/surfaceops-kanban-live/surfaceops-kanban-live-target-selection.json","schemaId":"surfaceops-kanban-live-target-selection.v0","sourceRef":null},{"hash":"b79b4b924ae333ad43d3f28d262c9dc0233db5b8edf20f81ed8ce30ad0bbbe0d","hashAlgorithm":"sha256","path":"artifacts/surfaceops-kanban-live/surfaceops-kanban-live-api-projection.json","schemaId":"kanban-cards-api-manifest.v0","sourceRef":null},{"hash":"e35f01528cde39132204053143730254812a36d9f39adec68e0be2d641da9d7b","hashAlgorithm":"sha256","path":"artifacts/surfaceops-kanban-live/surfaceops-kanban-live-operation-plan.json","schemaId":"surfaceops-kanban-live-operation-plan.v0","sourceRef":null},{"hash":"08e3bacf71c6b6fddb5bdf6be2bb9daec74bd2ef94516d0469244d5eb33338b5","hashAlgorithm":"sha256","path":"artifacts/surfaceops-kanban-live/surfaceops-kanban-live-handoff-record.json","schemaId":"surfaceops-kanban-live-handoff-record.v0","sourceRef":null}],"diagnostics":[{"artifactPath":"fixtures/surfaceops-kanban-live/mutations/api-manifest-hash-mismatch.surfaceops-kanban-live-preflight.json","canonicalMessage":"kanban.cards API manifest hash does not match the declared live boundary.","code":"SURFACEOPS_KANBAN_LIVE_API_MANIFEST_HASH_MISMATCH","fixtureCoverage":"mutations/api-manifest-hash-mismatch.surfaceops-kanban-live-preflight.json","jsonPointer":"/apiManifestRef/hash","message":"kanban.cards API manifest hash does not match the declared live boundary.","phase":"surfaceops-kanban-live-api-boundary","promotionStatus":"blocked","severity":"error","sourceRef":null,"stage":"api-boundary","suggestedAction":"Use the SurfaceOps-owned adapter boundary and regenerate live proof evidence after correcting the integration issue.","trigger":"kanban.cards API manifest hash does not match the declared live boundary.","validationResult":"invalid"},{"artifactPath":"fixtures/surfaceops-kanban-live/mutations/missing-api-manifest.surfaceops-kanban-live-preflight.json","canonicalMessage":"kanban.cards API manifest is missing.","code":"SURFACEOPS_KANBAN_LIVE_API_MANIFEST_MISSING","fixtureCoverage":"mutations/missing-api-manifest.surfaceops-kanban-live-preflight.json","jsonPointer":"/apiManifestRef","message":"kanban.cards API manifest is missing.","phase":"surfaceops-kanban-live-api-boundary","promotionStatus":"blocked","severity":"error","sourceRef":null,"stage":"api-boundary","suggestedAction":"Use the SurfaceOps-owned adapter boundary and regenerate live proof evidence after correcting the integration issue.","trigger":"kanban.cards API manifest is missing.","validationResult":"invalid"},{"artifactPath":"fixtures/surfaceops-kanban-live/invalid/authority-override.surfaceops-kanban-live.json","canonicalMessage":"kanban.cards must not override SurfaceOps or Surfaces authority.","code":"SURFACEOPS_KANBAN_LIVE_AUTHORITY_OVERRIDE","fixtureCoverage":"invalid/authority-override.surfaceops-kanban-live.json","jsonPointer":"/authority","message":"kanban.cards must not override SurfaceOps or Surfaces authority.","phase":"surfaceops-kanban-live-authority","promotionStatus":"blocked","severity":"error","sourceRef":"fixture://surfaceops-kanban-live/invalid/authority-override#/authority","stage":"authority","suggestedAction":"Use the SurfaceOps-owned adapter boundary and regenerate live proof evidence after correcting the integration issue.","trigger":"kanban.cards must not override SurfaceOps or Surfaces authority.","validationResult":"invalid"},{"artifactPath":"fixtures/surfaceops-kanban-live/invalid/conflict-silent-overwrite.surfaceops-kanban-live.json","canonicalMessage":"Divergent kanban state must create a conflict instead of silent overwrite.","code":"SURFACEOPS_KANBAN_LIVE_CONFLICT_REQUIRED","fixtureCoverage":"invalid/conflict-silent-overwrite.surfaceops-kanban-live.json","jsonPointer":"/conflictPolicy","message":"Divergent kanban state must create a conflict instead of silent overwrite.","phase":"surfaceops-kanban-live-conflict","promotionStatus":"blocked","severity":"error","sourceRef":"fixture://surfaceops-kanban-live/invalid/conflict-silent-overwrite#/conflictPolicy","stage":"conflict","suggestedAction":"Use the SurfaceOps-owned adapter boundary and regenerate live proof evidence after correcting the integration issue.","trigger":"Divergent kanban state must create a conflict instead of silent overwrite.","validationResult":"invalid"},{"artifactPath":"fixtures/surfaceops-kanban-live/mutations/hash-mismatch.surfaceops-kanban-live-evidence.json","canonicalMessage":"Live kanban evidence hash does not match the evidence manifest.","code":"SURFACEOPS_KANBAN_LIVE_EVIDENCE_HASH_MISMATCH","fixtureCoverage":"mutations/hash-mismatch.surfaceops-kanban-live-evidence.json","jsonPointer":"/artifacts","message":"Live kanban evidence hash does not match the evidence manifest.","phase":"surfaceops-kanban-live-evidence","promotionStatus":"blocked","severity":"error","sourceRef":null,"stage":"evidence","suggestedAction":"Use the SurfaceOps-owned adapter boundary and regenerate live proof evidence after correcting the integration issue.","trigger":"Live kanban evidence hash does not match the evidence manifest.","validationResult":"invalid"},{"artifactPath":"fixtures/surfaceops-kanban-live/invalid/missing-evidence-ref.surfaceops-kanban-live.json","canonicalMessage":"Live kanban operation requires exact SurfaceOps evidence references.","code":"SURFACEOPS_KANBAN_LIVE_EVIDENCE_REF_MISSING","fixtureCoverage":"invalid/missing-evidence-ref.surfaceops-kanban-live.json","jsonPointer":"/evidenceRefs","message":"Live kanban operation requires exact SurfaceOps evidence references.","phase":"surfaceops-kanban-live-operation-plan","promotionStatus":"blocked","severity":"error","sourceRef":"fixture://surfaceops-kanban-live/invalid/missing-evidence-ref#/evidenceRefs","stage":"operation-plan","suggestedAction":"Use the SurfaceOps-owned adapter boundary and regenerate live proof evidence after correcting the integration issue.","trigger":"Live kanban operation requires exact SurfaceOps evidence references.","validationResult":"invalid"},{"artifactPath":"fixtures/surfaceops-kanban-live/invalid/idempotency-missing.surfaceops-kanban-live.json","canonicalMessage":"Adapter operations require deterministic idempotency keys.","code":"SURFACEOPS_KANBAN_LIVE_IDEMPOTENCY_REQUIRED","fixtureCoverage":"invalid/idempotency-missing.surfaceops-kanban-live.json","jsonPointer":"/operations","message":"Adapter operations require deterministic idempotency keys.","phase":"surfaceops-kanban-live-idempotency","promotionStatus":"blocked","severity":"error","sourceRef":"fixture://surfaceops-kanban-live/invalid/idempotency-missing#/operations","stage":"idempotency","suggestedAction":"Use the SurfaceOps-owned adapter boundary and regenerate live proof evidence after correcting the integration issue.","trigger":"Adapter operations require deterministic idempotency keys.","validationResult":"invalid"},{"artifactPath":"fixtures/surfaceops-kanban-live/invalid/permission-bypass.surfaceops-kanban-live.json","canonicalMessage":"Adapter permissions must fail closed for denied kanban operations.","code":"SURFACEOPS_KANBAN_LIVE_PERMISSION_BYPASS","fixtureCoverage":"invalid/permission-bypass.surfaceops-kanban-live.json","jsonPointer":"/permissions","message":"Adapter permissions must fail closed for denied kanban operations.","phase":"surfaceops-kanban-live-permissions","promotionStatus":"blocked","severity":"error","sourceRef":"fixture://surfaceops-kanban-live/invalid/permission-bypass#/permissions","stage":"permissions","suggestedAction":"Use the SurfaceOps-owned adapter boundary and regenerate live proof evidence after correcting the integration issue.","trigger":"Adapter permissions must fail closed for denied kanban operations.","validationResult":"invalid"},{"artifactPath":"fixtures/surfaceops-kanban-live/invalid/production-url.surfaceops-kanban-live.json","canonicalMessage":"First live proof must run against local loopback kanban.cards only.","code":"SURFACEOPS_KANBAN_LIVE_PRODUCTION_URL_FORBIDDEN","fixtureCoverage":"invalid/production-url.surfaceops-kanban-live.json","jsonPointer":"/runtime/baseUrl","message":"First live proof must run against local loopback kanban.cards only.","phase":"surfaceops-kanban-live-runtime-boundary","promotionStatus":"blocked","severity":"error","sourceRef":"fixture://surfaceops-kanban-live/invalid/production-url#/runtime/baseUrl","stage":"runtime-boundary","suggestedAction":"Use the SurfaceOps-owned adapter boundary and regenerate live proof evidence after correcting the integration issue.","trigger":"First live proof must run against local loopback kanban.cards only.","validationResult":"invalid"},{"artifactPath":"fixtures/surfaceops-kanban-live/review/lane-move-signal-requires-decision.surfaceops-kanban-live.json","canonicalMessage":"Kanban lane movement is a collaboration signal until a structured SurfaceOps decision is committed.","code":"SURFACEOPS_KANBAN_LIVE_REVIEW_REQUIRED","fixtureCoverage":"review/lane-move-signal-requires-decision.surfaceops-kanban-live.json","jsonPointer":"/decisionBoundary","message":"Kanban lane movement is a collaboration signal until a structured SurfaceOps decision is committed.","phase":"surfaceops-kanban-live-decision-boundary","promotionStatus":"review_required","severity":"review","sourceRef":"fixture://surfaceops-kanb